{
    "dmxOutputs": 24, 
    "illuminationWeights": [ 0, 0, 0, 0, 0, 0, 0, 0, 0, 0, 0, 255, 127, 0, 0, 0, 255, 0, 255, 0, 255, 255, 255, 255  ],
    "ambientChannels": { 
        "foreground": [ 1, 2, 3 ],  
        "background": [ 6, 7, 8 ] 
    },
    "colorPresets": [ 
        {
            "foreground": [ 255, 0, 0 ], 
            "background": [ 0, 255, 0 ] 
        },
        {
            "foreground": [ 0, 255, 0 ], 
            "background": [ 0, 0,255 ] 
        },
        {
            "foreground": [ 0, 0, 255 ], 
            "background": [ 255, 0, 0 ] 
        }
    ]
}